{
  "schema_version": "1.0",
  "kind": "lab-artifact-reference",
  "artifact_id": "agentsim.synthetic.marker",
  "local_path": "synthetic-marker.txt",
  "sha256": "a46fc38301c4bef8f2f2b96cde06b43fa182da1771a98467d064201cd445d15e",
  "size_bytes": 105,
  "media_type": "text/plain",
  "artifact_type": "data",
  "platforms": ["any"],
  "purpose": "Exercise artifact identity, provenance, path, size, and digest review without executable content.",
  "provenance": {
    "schema_version": "1.0",
    "source": {
      "repository": "https://github.com/hellnbak/AgentSim",
      "revision": "8230f73a89841e7696771ce7ebd2109d7693ff04",
      "path": "labs/reference-agent/artifacts/synthetic-marker.txt"
    },
    "authors": ["AgentSim contributors"],
    "license": "MIT",
    "created_at": "2026-08-02T17:30:00Z",
    "review": {
      "status": "approved",
      "reviewer_id": "agentsim-maintainer-review",
      "reviewed_at": "2026-08-02T17:30:00Z",
      "policy_id": "agentsim-lab-artifact-review-v1"
    }
  },
  "controls": {
    "lab_only": true,
    "production_allowed": false,
    "network_access": "denied",
    "execution_allowed": false,
    "ephemeral_container_required": true,
    "cleanup_required": true,
    "max_runtime_seconds": 30,
    "max_memory_mb": 128
  },
  "integrity": {
    "algorithm": "sha256",
    "digest": "ffd739b8ba29496add9cdf1a7162c1d34b3de45f36965070648c7fa38e5b630f"
  }
}
